{
  "$schema": "http://json-schema.org/draft-07/schema#",
  "$id": "https://github.com/Thulr/informed-skills/blob/main/schemas/skill.schema.json",
  "title": "Skill manifest (skill.json)",
  "description": "Canonical shape for skills/<name>/skill.json and the reserved skills/.experimental/<name>/skill.json lane. Per-skill scripts assert name match via jq after schema validation passes.",
  "type": "object",
  "required": ["name", "description", "version", "license", "status", "maintainers", "inspired_by"],
  "additionalProperties": true,
  "properties": {
    "name": {
      "type": "string",
      "minLength": 1
    },
    "description": {
      "type": "string",
      "minLength": 1
    },
    "version": {
      "type": "string",
      "minLength": 1
    },
    "license": {
      "type": "string",
      "minLength": 1
    },
    "status": {
      "enum": ["draft", "reviewed", "published"]
    },
    "maintainers": {
      "type": "array",
      "minItems": 1,
      "items": {
        "type": "string",
        "pattern": "^@[A-Za-z0-9-]+(?:/[A-Za-z0-9-]+)?$"
      }
    },
    "tags": {
      "type": "array",
      "items": {"type": "string"}
    },
    "inspired_by": {
      "type": "array",
      "minItems": 1,
      "items": {
        "type": "object",
        "required": ["name", "author", "kind", "contribution"],
        "additionalProperties": true,
        "properties": {
          "name": {"type": "string", "minLength": 1},
          "author": {"type": "string", "minLength": 1},
          "kind": {"type": "string", "minLength": 1},
          "year": {"type": ["integer", "null"]},
          "contribution": {"type": "string", "minLength": 1},
          "playbooks": {
            "type": "array",
            "items": {"type": "string"}
          }
        }
      }
    },
    "metadata": {
      "type": "object",
      "properties": {
        "internal": {
          "type": "boolean",
          "description": "When true, the skill is hidden from catalog listings unless INSTALL_INTERNAL_SKILLS=1 (e.g. example-minimal)."
        },
        "family": {
          "enum": ["heuristics", "research", "ax"],
          "description": "Catalog family the skill belongs to. Single source of truth for README catalog grouping; consumed by scripts/build-catalog.py. Required on every published (non-internal) skill."
        },
        "function": {
          "enum": ["critique", "design", "singleton"],
          "description": "Where the skill sits in the critique/design matrix. 'singleton' for skills with no paired counterpart. Consumed by scripts/build-catalog.py."
        },
        "catalog_order": {
          "type": "integer",
          "description": "Optional explicit ordering within a family (lower first); skills without it sort by name after ordered ones."
        },
        "catalog_summary": {
          "type": "string",
          "minLength": 1,
          "description": "One-line markdown summary rendered as the skill's bullet in the generated README catalog. Required on every published (non-internal) skill."
        }
      }
    }
  }
}
