{
  "name": "rules-from-coding-agent-failures",
  "description": "Use when you operate coding-agent infrastructure with a feedback signal \u2014 eval suites, run-level telemetry, A/B baselines, or a skill catalog under test \u2014 and want to capture observed agent failures in a per-file reflection log, promote recurring patterns into AGENTS.md rules, hooks, or CI gates via the three-entry floor, and score Level 4-5 (Specification Architecture, Sovereign Engineering) maturity. Triggers on 'reflection log', 'agent failure log', 'promote this pattern into a rule', 'post-incident eval case', 'harness maturity Level 4 or 5', 'set up a feedback loop for agent failures'. Do NOT use for first-pass agent-readiness scaffolding when no feedback signal exists yet (use harden-repo-for-coding-agents), or to design or operate an AI product's eval and optimization loops (use agent-test / agent-ops).",
  "version": "0.1.0",
  "license": "MIT",
  "status": "published",
  "maintainers": [
    "@justinramos101"
  ],
  "tags": [
    "evidence-driven",
    "reflection-log",
    "agent-failures",
    "feedback-loop",
    "harness-engineering",
    "agents-md",
    "skill-md",
    "mcp",
    "claude-code",
    "cursor",
    "codex",
    "copilot",
    "windsurf",
    "aider",
    "evals",
    "telemetry",
    "governance",
    "maturity-rubric",
    "spec-architecture",
    "sovereign-engineering"
  ],
  "inspired_by": [
    {
      "name": "Engineering Agents \u2014 Harness Assessment",
      "author": "Engineering Agents",
      "kind": "guide",
      "year": 2025,
      "contribution": "Level 1\u20135 maturity rubric; reflection-log artifact as a Level 3 signal; 'weakest discipline is your ceiling.' This skill owns the Level 4\u20135 extension (Specification Architecture / Sovereign Engineering); `harden-repo-for-coding-agents` owns Levels 1\u20133.",
      "playbooks": [
        "reflection-log"
      ]
    },
    {
      "name": "Evaluating AGENTS.md: Are Repository-Level Context Files Helpful for Coding Agents?",
      "author": "M\u00fcndler et al. (ETH Z\u00fcrich / LogicStar.ai)",
      "kind": "paper",
      "year": 2026,
      "arxiv": "2602.11988",
      "contribution": "Empirical: autogenerated context files drop task success ~3% and inflate cost >20%; developer-written files improve by only ~4%. The empirical basis for W1 \u2014 the \u22653-observed-failures floor that gates this skill's `promote` workflow.",
      "playbooks": [
        "reflection-log"
      ]
    },
    {
      "name": "AGENTS.md",
      "author": "Agentic AI Foundation (Linux Foundation)",
      "kind": "spec",
      "year": 2025,
      "contribution": "The instruction-surface artifact that this skill's `promote` workflow writes rules into. AGENTS.md scaffolding itself is handled by `harden-repo-for-coding-agents` (this skill assumes one already exists).",
      "playbooks": [
        "reflection-log"
      ]
    },
    {
      "name": "Effective Context Engineering for AI Agents",
      "author": "Anthropic",
      "kind": "essay",
      "year": 2025,
      "contribution": "Token-budget framing: find smallest set of high-signal tokens that maximize the likelihood of desired outcome. Reflection-log entries are on-demand context (read only during `promote`), not always-loaded, so they don't inflate the always-loaded surface.",
      "playbooks": [
        "reflection-log"
      ]
    },
    {
      "name": "AI Risk Management Framework (and Generative AI Profile)",
      "author": "NIST",
      "kind": "guide",
      "year": 2023,
      "contribution": "Governance, content provenance, pre-deployment testing, incident disclosure. The reflection log is the audit trail for 'human rejected agent recommendation' events that the GenAI profile requires.",
      "playbooks": [
        "reflection-log"
      ]
    }
  ],
  "metadata": {
    "family": "ax",
    "function": "singleton",
    "catalog_order": 3,
    "catalog_summary": "capture observed agent failures in a per-file reflection log and promote recurring patterns into AGENTS.md rules / hooks / CI gates via the W1 \u22653-entry floor. For teams with a feedback signal \u2014 eval suites, run-level telemetry, A/B baselines, or a skill catalog under test. Provenance in [`skills/rules-from-coding-agent-failures/skill.json`](./skills/rules-from-coding-agent-failures/skill.json)."
  }
}
