{
  "name": "agent-dx",
  "description": "Use for AGENT DX \u2014 the surface an AI agent consumes as a developer. DO \u2014 keep SDK/tool/structured-output/error/telemetry changes agent-consumable. REVIEW \u2014 audit agent-facing surfaces for stable contracts, recovery, trust-boundary safety. DESIGN \u2014 shape new agent-facing surfaces. Triggers: 'design our Agent SDK', 'are our tool schemas agent-safe', 'review MCP surface', 'is telemetry leaking PII'",
  "version": "0.1.0",
  "license": "MIT",
  "status": "published",
  "maintainers": [
    "@justinramos101"
  ],
  "tags": [
    "agent-dx",
    "agent-experience",
    "ax",
    "ai-sdk",
    "agent-sdk",
    "mcp",
    "tool-calling",
    "structured-output",
    "agent-loop",
    "stop-conditions",
    "guardrails",
    "tool-description-injection",
    "lethal-trifecta",
    "token-exchange",
    "delegated-auth",
    "error-envelope",
    "semantic-retry",
    "observability",
    "pii-redaction",
    "audit",
    "design",
    "singleton"
  ],
  "inspired_by": [
    {
      "name": "Model Context Protocol specification",
      "author": "Anthropic",
      "kind": "spec",
      "year": 2024,
      "contribution": "A uniform protocol for exposing tools, resources, and prompts to agents; the model-visible tool name/description/schema is part of the contract and reaches the model before any human, which frames tool metadata as an untrusted-input and injection surface.",
      "playbooks": [
        "tools-and-mcp",
        "sdk-design"
      ]
    },
    {
      "name": "OpenTelemetry Semantic Conventions for Generative AI",
      "author": "OpenTelemetry",
      "kind": "spec",
      "year": 2025,
      "contribution": "A named span/attribute convention for agent loops (gen_ai.operation.name, usage tokens, finish reasons, conversation id) so per-step telemetry is portable; emitting structural spans on one convention separates structural from content telemetry.",
      "playbooks": [
        "sdk-telemetry",
        "sdk-design"
      ]
    },
    {
      "name": "OAuth 2.0 Token Exchange (RFC 8693)",
      "author": "IETF",
      "kind": "spec",
      "year": 2020,
      "contribution": "A broker exchanges a credential for a token constrained by resource, audience, scope, and short TTL \u2014 the enforcement primitive behind delegated auth, so an agent acts on a user's behalf without holding the durable secret.",
      "playbooks": [
        "tools-and-mcp"
      ]
    }
  ],
  "metadata": {
    "family": "ax",
    "function": "singleton",
    "catalog_summary": "Agent-as-developer: keep the SDK/tool/error/telemetry surface an AI agent consumes minimal and safe \u2014 DO (keep an agent-facing change agent-consumable), REVIEW (audit a surface for stable contracts, agent recovery, and trust-boundary safety, then score it), DESIGN (shape a new SDK/tool/MCP/structured-output/error/telemetry surface). For the human developer surface underneath it, use dx-audit / dx-design."
  }
}
