{
  "name": "architecture-design",
  "description": "Heuristic DESIGN, refactor sequencing, and EXPLANATION of clean architecture — set the dependency-rule invariant for new work, shape layer/port/adapter boundaries, model entities/aggregates/value objects, carve a bounded context, plan a reversible refactor toward ports and adapters (strangler-fig, branch-by-abstraction), or explain a principle grounded in the canonical sources. Emits a design doc, a refactor runbook, or a grounded explainer. To AUDIT and score an existing codebase for violations use architecture-audit; for developer-facing API/SDK/CLI surfaces use dx-design; for product UX, forms, navigation, and accessibility use ux-audit or ui-design. Opinionated terrain; surfaces school disagreements explicitly. Language-agnostic, full-stack-friendly. Grounded in the canonical architecture literature (provenance below).",
  "version": "0.1.0",
  "license": "MIT",
  "status": "published",
  "maintainers": [
    "@Thulr"
  ],
  "tags": [
    "design",
    "refactor",
    "explain",
    "architecture",
    "clean-architecture",
    "hexagonal",
    "onion",
    "ports-and-adapters",
    "ddd",
    "domain-driven-design",
    "bounded-context",
    "dependency-rule",
    "solid",
    "strangler-fig",
    "cross-cutting",
    "heuristics"
  ],
  "inspired_by": [
    {
      "name": "On the Criteria To Be Used in Decomposing Systems into Modules",
      "author": "David Parnas",
      "kind": "paper",
      "year": 1972,
      "contribution": "Information hiding as the basis of module decomposition; 'what should be hidden' as the criterion that predates and underwrites every later layering scheme.",
      "playbooks": ["boundaries", "dependency-rule"]
    },
    {
      "name": "Hexagonal Architecture",
      "author": "Alistair Cockburn",
      "kind": "article",
      "year": 2005,
      "contribution": "Ports and adapters; the application has interior ports and exterior adapters that translate to/from external technologies. Symmetric inbound/outbound framing.",
      "playbooks": ["boundaries"]
    },
    {
      "name": "The Onion Architecture",
      "author": "Jeffrey Palermo",
      "kind": "article",
      "year": 2008,
      "contribution": "Concentric rings; outer rings depend on inner rings, never the reverse. Dependency-rule expressed as geometry.",
      "playbooks": ["boundaries"]
    },
    {
      "name": "Agile Software Development: Principles, Patterns, and Practices",
      "author": "Robert C. Martin",
      "kind": "book",
      "year": 2003,
      "contribution": "SOLID; package cohesion (REP, CCP, CRP) and package coupling (ADP, SDP, SAP) principles. Foundational frame for the dependency rule.",
      "playbooks": ["dependency-rule"]
    },
    {
      "name": "Clean Architecture: A Craftsman's Guide to Software Structure and Design",
      "author": "Robert C. Martin",
      "kind": "book",
      "year": 2017,
      "contribution": "The dependency rule as the single load-bearing invariant; concentric layers (entities, use cases, interface adapters, frameworks & drivers).",
      "playbooks": ["dependency-rule", "boundaries"]
    },
    {
      "name": "Domain-Driven Design: Tackling Complexity in the Heart of Software",
      "author": "Eric Evans",
      "kind": "book",
      "year": 2003,
      "contribution": "Ubiquitous language; entities, value objects, aggregates, domain services, repositories; bounded contexts and context mapping.",
      "playbooks": ["domain-model", "bounded-context"]
    },
    {
      "name": "Implementing Domain-Driven Design",
      "author": "Vaughn Vernon",
      "kind": "book",
      "year": 2013,
      "contribution": "Pragmatic tactical-DDD detail: aggregate-design rules, eventual consistency between aggregates, integration patterns between contexts.",
      "playbooks": ["domain-model", "bounded-context"]
    },
    {
      "name": "Learning Domain-Driven Design",
      "author": "Vlad Khononov",
      "kind": "book",
      "year": 2021,
      "contribution": "Modern DDD framing; subdomain types (core, supporting, generic) inform context boundaries and integration patterns.",
      "playbooks": ["bounded-context", "cross-cutting"]
    },
    {
      "name": "AnemicDomainModel",
      "author": "Martin Fowler",
      "kind": "essay",
      "year": 2003,
      "contribution": "Names the anti-pattern of domain objects that hold only data while logic lives in service classes — undercuts the entire point of object-oriented domain modeling.",
      "playbooks": ["domain-model"]
    },
    {
      "name": "BoundedContext",
      "author": "Martin Fowler",
      "kind": "essay",
      "year": 2014,
      "contribution": "Compact restatement of bounded context: a model is valid only within its context; cross-context translation is explicit.",
      "playbooks": ["bounded-context"]
    },
    {
      "name": "Patterns of Enterprise Application Architecture",
      "author": "Martin Fowler",
      "kind": "book",
      "year": 2002,
      "contribution": "Layered architecture; Repository, Unit of Work, Data Mapper, Service Layer patterns. The catalog underwriting most adapter-side mechanics.",
      "playbooks": ["boundaries", "cross-cutting"]
    },
    {
      "name": "Enterprise Integration Patterns",
      "author": "Gregor Hohpe and Bobby Woolf",
      "kind": "book",
      "year": 2003,
      "contribution": "Messaging patterns; integration between bounded contexts via channels, translators, and routers rather than shared databases.",
      "playbooks": ["bounded-context", "cross-cutting"]
    },
    {
      "name": "Monolith to Microservices",
      "author": "Sam Newman",
      "kind": "book",
      "year": 2019,
      "contribution": "Strangler-fig, branch-by-abstraction, and other sequenced patterns for extracting bounded contexts without big-bang rewrites.",
      "playbooks": ["bounded-context"]
    },
    {
      "name": "Building Microservices",
      "author": "Sam Newman",
      "kind": "book",
      "year": 2021,
      "contribution": "Service decomposition aligned to bounded contexts; coupling-vs-cohesion trade-offs for context boundaries.",
      "playbooks": ["bounded-context"]
    },
    {
      "name": "Flux: An Application Architecture for React",
      "author": "Facebook",
      "kind": "guide",
      "year": 2014,
      "contribution": "Unidirectional data flow: actions → dispatcher → stores → views. Frontend analog of the dependency rule.",
      "playbooks": ["boundaries"]
    },
    {
      "name": "The Elm Architecture",
      "author": "Evan Czaplicki",
      "kind": "guide",
      "year": 2015,
      "contribution": "Model-update-view with pure functions and explicit side-effect handling. Frontend grounding for layered boundaries and effect isolation.",
      "playbooks": ["boundaries", "cross-cutting"]
    },
    {
      "name": "A Philosophy of Software Design",
      "author": "John Ousterhout",
      "kind": "book",
      "year": 2018,
      "contribution": "Deep modules with simple interfaces; defining errors out of existence; comments as design. Underwrites both boundary design and cross-cutting error handling.",
      "playbooks": ["boundaries"]
    }
  ],
  "metadata": {
    "family": "heuristics",
    "function": "design",
    "catalog_summary": "Set the dependency-rule invariant for new work, shape layer/port/adapter boundaries, model entities/aggregates/value objects, carve a bounded context, and sequence a safe refactor."
  }
}
