{
  "name": "test-critique",
  "description": "Heuristic CRITIQUE of an existing test suite — review tests for smells, redundancy, false-pass risk, brittleness, and flakiness and score them, or triage one test that is failing, flaky, or unacceptably slow, across unit, integration, e2e/UI, exploratory, property-based, contract, snapshot, mutation, and performance layers. Use to REVIEW a suite for credibility and score it, or DIAGNOSE a specific failing/flaky/slow test; emits a scored findings report with a severity-rated, trackable ledger. To AUTHOR, strategize, or prune tests use test-design; for production-system performance/SLOs use perf-critique. Grounded in canonical testing literature (provenance below).",
  "version": "0.1.0",
  "license": "MIT",
  "status": "published",
  "maintainers": [
    "@Thulr"
  ],
  "tags": [
    "critique",
    "test-review",
    "triage",
    "test-quality",
    "heuristics",
    "testing",
    "unit",
    "integration",
    "e2e",
    "exploratory",
    "property-based",
    "contract",
    "snapshot",
    "mutation",
    "performance",
    "flakiness",
    "false-pass",
    "brittleness"
  ],
  "inspired_by": [
    {
      "name": "xUnit Test Patterns: Refactoring Test Code",
      "author": "Gerard Meszaros",
      "kind": "book",
      "year": 2007,
      "contribution": "The canonical test-smell catalog and the test-fixture / object-mother / test-data-builder vocabulary used across the unit, integration, snapshot, and failure-modes references.",
      "playbooks": [
        "unit",
        "integration",
        "snapshot"
      ]
    },
    {
      "name": "Working Effectively with Legacy Code",
      "author": "Michael Feathers",
      "kind": "book",
      "year": 2004,
      "contribution": "Characterization tests, seams, and the test-as-pin-down technique. Anchors the characterization-purpose framing across unit and integration playbooks.",
      "playbooks": [
        "unit",
        "integration"
      ]
    },
    {
      "name": "Test-Driven Development By Example",
      "author": "Kent Beck",
      "kind": "book",
      "year": 2002,
      "contribution": "Spec-purpose framing, the red/green/refactor cadence, and the discipline of writing the test that drives the design.",
      "playbooks": [
        "unit"
      ]
    },
    {
      "name": "Unit Testing: Principles, Practices, and Patterns",
      "author": "Vladimir Khorikov",
      "kind": "book",
      "year": 2020,
      "contribution": "The four-quadrant test-value model: protection-against-regressions x resistance-to-refactoring x fast-feedback x maintainability. Anchors the false-pass mode and the score rubric's robustness dimension.",
      "playbooks": [
        "unit",
        "review-intent"
      ]
    },
    {
      "name": "Explore It! Reduce Risk and Increase Confidence with Exploratory Testing",
      "author": "Elisabeth Hendrickson",
      "kind": "book",
      "year": 2013,
      "contribution": "Charter-driven exploratory testing, session-based test management, and the role of automated tests as scaffolding for exploration.",
      "playbooks": [
        "exploratory"
      ]
    },
    {
      "name": "Rapid Software Testing methodology",
      "author": "James Bach and Michael Bolton",
      "kind": "guide",
      "year": null,
      "contribution": "The SFDIPOT mnemonic for testable aspects and the FEW HICCUPPS consistency oracles, distilled into the oracles core reference.",
      "playbooks": [
        "exploratory"
      ]
    },
    {
      "name": "QuickCheck: A Lightweight Tool for Random Testing of Haskell Programs",
      "author": "John Hughes and Koen Claessen",
      "kind": "paper",
      "year": 2000,
      "contribution": "The original property-based testing framework and the shrinking idea - failures shrink to a minimal counterexample.",
      "playbooks": [
        "property-based"
      ]
    },
    {
      "name": "Hypothesis design rationale",
      "author": "David R. MacIver",
      "kind": "guide",
      "year": null,
      "contribution": "Practical generator design, choosing properties, and the integration of property-based testing into mainstream test suites.",
      "playbooks": [
        "property-based"
      ]
    },
    {
      "name": "Agile Testing: A Practical Guide for Testers and Agile Teams",
      "author": "Lisa Crispin and Janet Gregory",
      "kind": "book",
      "year": 2008,
      "contribution": "The agile testing quadrants and the practical framing of test-strategy decisions across layers.",
      "playbooks": [
        "e2e-ui"
      ]
    },
    {
      "name": "The Practical Test Pyramid",
      "author": "Ham Vocke",
      "kind": "essay",
      "year": 2018,
      "contribution": "Concrete practical layer definitions and the often-quoted critique that pyramid is more shape-suggestion than rule.",
      "playbooks": [
        "e2e-ui"
      ]
    },
    {
      "name": "Approval Testing",
      "author": "Llewellyn Falco",
      "kind": "guide",
      "year": null,
      "contribution": "The approval-testing pattern (snapshot-style review of generated output) and the discipline of human review of every diff.",
      "playbooks": [
        "snapshot"
      ]
    },
    {
      "name": "An Analysis and Survey of the Development of Mutation Testing",
      "author": "Yue Jia and Mark Harman",
      "kind": "paper",
      "year": 2011,
      "contribution": "Comprehensive survey of mutation testing techniques, equivalent-mutant problem, and operator selection strategies.",
      "playbooks": [
        "mutation"
      ]
    },
    {
      "name": "Are Mutants a Valid Substitute for Real Faults in Software Testing?",
      "author": "Rene Just",
      "kind": "paper",
      "year": 2014,
      "contribution": "Empirical evidence that mutation score correlates with real-fault detection, validating mutation testing as a meaningful signal.",
      "playbooks": [
        "mutation"
      ]
    },
    {
      "name": "Consumer-Driven Contracts: A Service Evolution Pattern",
      "author": "Ian Robinson",
      "kind": "essay",
      "year": 2006,
      "contribution": "The CDC pattern - consumers state what they actually use; providers verify that subset. Foundation of modern contract testing.",
      "playbooks": [
        "contract"
      ]
    },
    {
      "name": "Pact Foundation documentation",
      "author": "Pact Foundation contributors",
      "kind": "guide",
      "year": null,
      "contribution": "Practical patterns for broker-published pacts, provider-side verification, and integrating contract tests into CI.",
      "playbooks": [
        "contract"
      ]
    },
    {
      "name": "An Empirical Analysis of Flaky Tests",
      "author": "Qingzhou Luo",
      "kind": "paper",
      "year": 2014,
      "contribution": "Categorization of flakiness root causes (async wait, ordering, network, time, concurrency) used in the failure-modes file.",
      "playbooks": [
        "all"
      ]
    },
    {
      "name": "Flaky Tests at Google and How We Mitigate Them",
      "author": "John Micco",
      "kind": "essay",
      "year": 2016,
      "contribution": "Industrial-scale flakiness mitigation: quarantine, ownership, deflake-or-delete deadlines.",
      "playbooks": [
        "all"
      ]
    },
    {
      "name": "Systems Performance: Enterprise and the Cloud",
      "author": "Brendan Gregg",
      "kind": "book",
      "year": 2020,
      "contribution": "The USE method (utilization, saturation, errors) and the discipline of profiling before optimizing. Anchors the performance playbook's choice-of-what-to-measure framing.",
      "playbooks": [
        "performance"
      ]
    }
  ],
  "metadata": {
    "family": "heuristics",
    "function": "critique",
    "catalog_summary": "Review a test suite for smells, redundancy, false-pass risk, brittleness, and flakiness and score it, or triage one failing, flaky, or slow test."
  }
}
