{
  "name": "design-for-agents",
  "description": "Use to DESIGN or REVIEW software, docs, SDKs, and repos so AI agents can consume them as a first-class audience \u2014 agent experience (AX), the agent-facing analog of UX and DX. Covers agent-readable docs (llms.txt, AGENTS.md, MCP and tool descriptions, RAG-friendly structure), AI and Agent SDK design (streaming, tools, structured output, agent loops, tracing), repo agent-readiness review, and human-versus-agent audience conflicts. The umbrella AX discipline \u2014 it routes to codebase-agent-readiness to HARDEN a repo, evidence-driven-agent-rules to PROMOTE observed failures into rules, and eval-flywheel to INSTRUMENT an AI product's eval loops. Triggers on 'make our app agent-friendly', 'review our llms.txt for agents', 'design an Agent SDK', 'is this AGENTS.md agent-ready', 'AX review'. Do NOT use for human developer experience (use dx-critique or dx-design), end-user UX (use ux-critique), or to actually scaffold a repo's gates and hooks (use codebase-agent-readiness).",
  "version": "0.1.0",
  "license": "MIT",
  "status": "published",
  "maintainers": [
    "@Thulr"
  ],
  "tags": [
    "design-for-agents",
    "ax",
    "agents-md",
    "llms-txt",
    "skill-md",
    "mcp",
    "ai-sdk",
    "agent-sdk",
    "agent-readable-docs",
    "retrieval-friendly",
    "context-engineering",
    "audience-conflicts",
    "claude-code",
    "cursor",
    "codex",
    "copilot",
    "windsurf",
    "aider"
  ],
  "inspired_by": [
    {
      "name": "AGENTS.md",
      "author": "Agentic AI Foundation (Linux Foundation)",
      "kind": "spec",
      "year": 2025,
      "contribution": "Vendor-neutral, hand-curated repo-root contract coding agents read first; hierarchical discovery with closest-file precedence. Grounds repo agent-readiness review.",
      "playbooks": [
        "agent"
      ]
    },
    {
      "name": "Agent Skills (agentskills.io)",
      "author": "Anthropic",
      "kind": "spec",
      "year": 2025,
      "contribution": "SKILL.md format and progressive disclosure (~100-token metadata at startup, full instructions on trigger); grounds always-loaded vs load-on-demand splits and trigger-description authoring.",
      "playbooks": [
        "ax-docs"
      ]
    },
    {
      "name": "Model Context Protocol",
      "author": "Anthropic / Linux Foundation",
      "kind": "spec",
      "year": 2024,
      "contribution": "Capabilities-as-API: tools, resources, prompts with typed inputSchema; grounds MCP-as-tool-source for SDKs and MCP/tool descriptions as agent-facing docs.",
      "playbooks": [
        "ai-sdk",
        "agent",
        "ax-docs"
      ]
    },
    {
      "name": "Evaluating AGENTS.md: Are Repository-Level Context Files Helpful for Coding Agents?",
      "author": "M\u00fcndler et al. (ETH Z\u00fcrich / LogicStar.ai)",
      "kind": "paper",
      "year": 2026,
      "arxiv": "2602.11988",
      "contribution": "Empirical: autogenerated context files drop task success ~3% and inflate cost >20%; always-loaded context must be minimal and measured. Grounds the no-/init and minimal-context heuristics.",
      "playbooks": [
        "agent",
        "ax-docs"
      ]
    },
    {
      "name": "Effective Context Engineering for AI Agents",
      "author": "Anthropic",
      "kind": "essay",
      "year": 2025,
      "contribution": "Token-budget framing: find the smallest set of high-signal tokens that maximize the likelihood of the desired outcome. Grounds the load-budget split and context-budget heuristics.",
      "playbooks": [
        "ax-docs"
      ]
    },
    {
      "name": "OpenTelemetry Semantic Conventions (GenAI)",
      "author": "CNCF / OpenTelemetry",
      "kind": "spec",
      "year": 2023,
      "contribution": "Canonical GenAI span/attribute names (gen_ai.operation.name, usage tokens, finish reasons, conversation id); grounds tracing-as-default for AI/Agent SDKs.",
      "playbooks": [
        "ai-sdk"
      ]
    },
    {
      "name": "OpenAPI Specification 3.1.0",
      "author": "OpenAPI Initiative",
      "kind": "spec",
      "year": 2021,
      "contribution": "Schema and description fields as agent-facing documentation; reinforces machine-readable contracts over prose.",
      "playbooks": [
        "ax-docs"
      ]
    },
    {
      "name": "MCP Tool Descriptions Are Smelly!",
      "author": "Hasan et al.",
      "kind": "paper",
      "year": 2026,
      "contribution": "Evidence that targeted, eval-improved tool descriptions raise tool-call success; grounds the trigger-description test and description quality measures.",
      "playbooks": [
        "ax-docs"
      ]
    },
    {
      "name": "Cloudflare documentation for AI tooling",
      "author": "Cloudflare",
      "kind": "docs",
      "year": 2026,
      "contribution": "Single-source, multiple-rendering pattern for humans and agents; markdown rendering, token budgeting, and retrieval-friendly authoring.",
      "playbooks": [
        "ax-docs",
        "audience-conflicts"
      ]
    },
    {
      "name": "Research Report \u2014 Effective Documentation Patterns and Practices for DX, AX, and UX",
      "author": "Informed Skills research synthesis",
      "kind": "report",
      "year": 2026,
      "contribution": "Synthesizes the unique AX documentation requirements and the human-vs-agent conflict set with a shared/modified/unique inheritance model.",
      "playbooks": [
        "ax-docs",
        "audience-conflicts"
      ]
    }
  ],
  "metadata": {
    "family": "ax",
    "function": "singleton",
    "catalog_order": 1,
    "catalog_summary": "the umbrella discipline. Owns the AX review heuristics (agent-readable docs, AI/Agent SDK design, repo agent-readiness, human-vs-agent audience conflicts) and routes to the three arms below for the *doing*. It is a distinct discipline that routes *across* top-level skills (see [`docs/adr/0006`](./docs/adr/0006-discipline-front-doors-vs-one-engine-many-surfaces.md)). Installed standalone it is **review-only** \u2014 its build/harden/measure routes point at the arms, so install those alongside it for the full discipline. Provenance in [`skills/design-for-agents/skill.json`](./skills/design-for-agents/skill.json)."
  }
}
