{
  "name": "opportunity-research",
  "description": "Validate a named product, business, or feature opportunity across 14 dimensions of opportunity research — market, customer, competitive, domain, technical, data, operational, financial, legal, channel, GTM, stakeholder, risk, trend. Every research branch ends in a decision (F/A/D/R memo), not a note — for open-ended topic research with no decision attached, use `topic-research` instead. Two-level routing (intent × area) with sub-agent fan-out per area and per persona lens. Produces one of 18 templated artifacts: scope plan, investigation brief, cross-area brief, F/A/D/R memo, plus 14 area-specific artifacts (market sizing, ICP+JTBD, competitor map, domain glossary, technical feasibility, data inventory, operating model, unit economics, legal register, channel plan, GTM plan, stakeholder map, risk register, trend horizon). Grounded in canonical product / strategy / venture literature.",
  "version": "0.1.0",
  "license": "MIT",
  "status": "published",
  "maintainers": ["@Thulr"],
  "tags": [
    "opportunity-research", "discovery", "validation", "strategy",
    "product", "founder", "research",
    "market", "customer", "competitive", "domain", "technical",
    "data", "operational", "financial", "legal", "channel",
    "gtm", "stakeholder", "risk", "trend",
    "fadr", "go-no-go"
  ],
  "inspired_by": [
    {
      "name": "Opportunity Research Taxonomy (convo.txt)",
      "author": "User-curated notes, this repo",
      "kind": "notes",
      "year": 2026,
      "contribution": "The 14-area taxonomy, the four-layer Facts/Assumptions/Decisions/Risks frame, the minimum-viable first-pass subset of six areas (Customer / Market / Competitive / Domain / Technical / Financial), and the 'a research branch that ends in notes but not decisions is just organized procrastination' decision-gate principle.",
      "playbooks": ["market", "customer", "competitive", "domain", "technical", "data", "operational", "financial", "legal", "channel", "gtm", "stakeholder", "risk", "trend", "synthesize", "decide"]
    },
    {
      "name": "The Lean Startup",
      "author": "Eric Ries",
      "kind": "book",
      "year": 2011,
      "contribution": "Build-Measure-Learn loop; validated learning; pivot vs persevere as a forward-commitment decision rather than a vibe.",
      "playbooks": ["customer", "risk"]
    },
    {
      "name": "Know Your Customers' Jobs to Be Done",
      "author": "Clayton M. Christensen, Taddy Hall, Karen Dillon, David S. Duncan",
      "kind": "article",
      "year": 2016,
      "contribution": "Jobs-to-be-done framing: name the job, the context, and what is being fired. Competing-against-non-consumption frames substitutes and do-nothing as first-class competitors.",
      "playbooks": ["customer", "competitive"]
    },
    {
      "name": "The Five Competitive Forces That Shape Strategy",
      "author": "Michael E. Porter",
      "kind": "article",
      "year": 2008,
      "contribution": "Industry attractiveness as a function of rivalry + buyer power + supplier power + substitutes + new-entrant threat. A market can be big and still unattractive.",
      "playbooks": ["competitive", "market"]
    },
    {
      "name": "Crossing the Chasm (3rd ed.)",
      "author": "Geoffrey A. Moore",
      "kind": "book",
      "year": 2014,
      "contribution": "Technology-adoption lifecycle; early-market vs mainstream gap; beachhead segment — pick one tightly-defined initial segment whose adoption proves the next segment is winnable.",
      "playbooks": ["market", "gtm", "customer"]
    },
    {
      "name": "Obviously Awesome",
      "author": "April Dunford",
      "kind": "book",
      "year": 2019,
      "contribution": "Positioning as deliberate context-setting: who is this for, what reference frame should the buyer hold the product against, and why those tradeoffs matter to them. Defaults are someone else's positioning.",
      "playbooks": ["gtm", "competitive"]
    },
    {
      "name": "Four Fits for $100M+ Growth",
      "author": "Brian Balfour",
      "kind": "essay",
      "year": 2017,
      "contribution": "Beyond product/market fit, scale requires product/channel fit, channel/model fit, and model/market fit. A mismatch on any pair caps growth.",
      "playbooks": ["channel", "gtm", "financial"]
    },
    {
      "name": "SaaS Metrics 2.0",
      "author": "David Skok",
      "kind": "essay",
      "year": 2013,
      "contribution": "Canonical SaaS unit economics: CAC, LTV, payback period, gross margin, magic number, LTV/CAC > 3, payback < 12 months as common benchmarks.",
      "playbooks": ["financial"]
    },
    {
      "name": "Domain-Driven Design",
      "author": "Eric Evans",
      "kind": "book",
      "year": 2003,
      "contribution": "Ubiquitous language; bounded contexts; the cost of getting the domain model wrong. Domain understanding precedes design; the glossary is load-bearing, not decoration.",
      "playbooks": ["domain"]
    },
    {
      "name": "Antifragile",
      "author": "Nassim Nicholas Taleb",
      "kind": "book",
      "year": 2012,
      "contribution": "Fragile / robust / antifragile classification; concentration risk; convexity. Risk is structural, not just probabilistic.",
      "playbooks": ["risk"]
    },
    {
      "name": "Continuous Discovery Habits",
      "author": "Teresa Torres",
      "kind": "book",
      "year": 2021,
      "contribution": "Opportunity solution tree; weekly customer touchpoints; assumption tests vs discovery — research is a habit, not a phase.",
      "playbooks": ["customer", "scope-intent"]
    },
    {
      "name": "Performing a Project Premortem",
      "author": "Gary Klein",
      "kind": "article",
      "year": 2007,
      "contribution": "Imagine the project failed in 12–18 months; work backwards to causes. Catches dissent that doesn't surface in current-state reviews. Used as a heuristic within `risk` here; the dedicated `premortem` skill runs the full interview.",
      "playbooks": ["risk"]
    },
    {
      "name": "Just Enough Research (2nd ed.)",
      "author": "Erika Hall",
      "kind": "book",
      "year": 2019,
      "contribution": "Right-sized research; 'research is just having the answers'; the explicit multiple-types-of-research taxonomy (organizational, user, design, competitive, evaluative).",
      "playbooks": ["scope-intent", "customer", "synthesize-intent"]
    },
    {
      "name": "Zero to One",
      "author": "Peter Thiel",
      "kind": "book",
      "year": 2014,
      "contribution": "Last-mover advantage; secrets (what important truth do very few people agree with you on?); the monopoly-vs-competition frame; build durable moats rather than chase parity.",
      "playbooks": ["competitive", "market"]
    },
    {
      "name": "Technological Revolutions and Financial Capital",
      "author": "Carlota Perez",
      "kind": "book",
      "year": 2002,
      "contribution": "Five surges of technological revolution; installation period vs deployment period; long-wave timing frames for trend analysis.",
      "playbooks": ["trend"]
    },
    {
      "name": "Diátaxis Documentation Framework",
      "author": "Daniele Procida",
      "kind": "guide",
      "year": 2020,
      "contribution": "Four-quadrant separation (tutorial / how-to / reference / explanation). Applied to opportunity research: 14 area artifacts are reference + explanation; tutorials and how-tos live elsewhere. Don't mix kinds in one artifact.",
      "playbooks": ["scope-intent", "synthesize-intent"]
    },
    {
      "name": "The Only Thing That Matters",
      "author": "Marc Andreessen",
      "kind": "essay",
      "year": 2007,
      "contribution": "Market quality dominates team and product; product/market fit threshold; the market 'pulls' a fit-finding product.",
      "playbooks": ["market", "customer"]
    },
    {
      "name": "Stripe Atlas Guides",
      "author": "Stripe",
      "kind": "guide",
      "year": null,
      "contribution": "Operational and legal patterns for early-stage businesses: entity formation, sales tax exposure, international expansion, contracts, IP, payment compliance.",
      "playbooks": ["legal", "operational"]
    },
    {
      "name": "How to Get Startup Ideas (and the Y Combinator essay series)",
      "author": "Paul Graham",
      "kind": "essay",
      "year": 2012,
      "contribution": "Live-in-the-future framing; organic vs made-up ideas; founder-as-her-own-customer; the trap of plausible-but-unimportant problems.",
      "playbooks": ["scope-intent"]
    },
    {
      "name": "Architecture Tradeoff Analysis Method (ATAM)",
      "author": "Rick Kazman, Mark Klein, Paul Clements (SEI)",
      "kind": "guide",
      "year": 2000,
      "contribution": "Quality-attribute tradeoffs as named scenarios; sensitivity points; risk themes. Adapted here to frame build-vs-buy and architecture-option decisions inside the technical playbook.",
      "playbooks": ["technical"]
    },
    {
      "name": "Platform-Dependence and Growth Loops (Reforge)",
      "author": "Andrew Chen",
      "kind": "essay",
      "year": 2018,
      "contribution": "Channel platform-dependence as a first-class risk class; growth loops (compounding mechanisms) as the scalability test for any channel.",
      "playbooks": ["channel"]
    }
  ]
}
