{
  "name": "writing-design",
  "description": "Use to DESIGN or shape a NEW piece of writing before or while drafting \u2014 structure an argument or memo (PRD, RFC, recommendation, strategy), organize a task-oriented technical doc or explainer, get a first pass down without stalling, or give a talk, pitch, launch post, or narrative a persuasive arc. Routes by intent (structure / draft / persuade) \u00d7 genre (argument-memo / technical-doc / talk-pitch / narrative / general-prose). Triggers on \"help me outline this RFC\", \"draft this announcement\", \"make this pitch land\", \"give this post an arc\", \"structure this doc before I write it\". Do NOT use to revise, copyedit, or diagnose an EXISTING draft (use writing-audit), to design a documentation system's IA, retrieval, or telemetry (use docs-design), or to gather and validate source material (use research).",
  "version": "0.1.0",
  "license": "MIT",
  "status": "published",
  "maintainers": [
    "@Thulr"
  ],
  "tags": [
    "design",
    "writing-design",
    "writing",
    "communication",
    "heuristics",
    "prose",
    "structure",
    "argument",
    "memo",
    "technical-writing",
    "persuasion",
    "storytelling",
    "narrative",
    "drafting",
    "rhetoric",
    "clarity"
  ],
  "inspired_by": [
    {
      "name": "The Pyramid Principle",
      "author": "Barbara Minto",
      "kind": "book",
      "year": 1987,
      "contribution": "Lead with the answer (top-down); the Situation-Complication-Question-Answer intro; group support mutually-exclusive and collectively-exhaustive.",
      "playbooks": ["argument-memo", "technical-doc"]
    },
    {
      "name": "Writing Software Documentation: A Task-Oriented Approach",
      "author": "Thomas Barker",
      "kind": "book",
      "year": 1998,
      "contribution": "Organize by what the user is trying to accomplish, not by features; audience and task analysis; decompose into ordered one-action steps; write minimally.",
      "playbooks": ["technical-doc"]
    },
    {
      "name": "Bird by Bird",
      "author": "Anne Lamott",
      "kind": "book",
      "year": 1994,
      "contribution": "Permission to write a deliberately rough first pass; shrink the task to the next small unit; separate generating from editing.",
      "playbooks": ["draft-intent"]
    },
    {
      "name": "On Writing Well",
      "author": "William Zinsser",
      "kind": "book",
      "year": 1976,
      "contribution": "Strip clutter; plain words over inflated ones; clarity is manufactured in revision.",
      "playbooks": ["general-prose"]
    },
    {
      "name": "The Sense of Style",
      "author": "Steven Pinker",
      "kind": "book",
      "year": 2014,
      "contribution": "Direct concrete style; the expert blind spot; order given-information before new.",
      "playbooks": ["general-prose", "technical-doc"]
    },
    {
      "name": "Made to Stick",
      "author": "Chip Heath & Dan Heath",
      "kind": "book",
      "year": 2007,
      "contribution": "The six-part stickiness checklist (simple, unexpected, concrete, credible, emotional, story).",
      "playbooks": ["talk-pitch", "narrative"]
    },
    {
      "name": "Resonate",
      "author": "Nancy Duarte",
      "kind": "book",
      "year": 2010,
      "contribution": "Oscillate between what-is and what-could-be; plant one memorable peak; cast the audience as hero.",
      "playbooks": ["talk-pitch"]
    },
    {
      "name": "Building a StoryBrand",
      "author": "Donald Miller",
      "kind": "book",
      "year": 2017,
      "contribution": "The audience is the hero and you are the guide; compress to a one-liner; the few-second stranger test.",
      "playbooks": ["talk-pitch"]
    },
    {
      "name": "Story",
      "author": "Robert McKee",
      "kind": "book",
      "year": 1997,
      "contribution": "The gap between expectation and result; the turning point where a value flips as the spine of a section.",
      "playbooks": ["narrative"]
    },
    {
      "name": "The Anatomy of Story",
      "author": "John Truby",
      "kind": "book",
      "year": 2007,
      "contribution": "The throughline: the visible goal versus the deeper need it actually addresses.",
      "playbooks": ["narrative"]
    },
    {
      "name": "Wired for Story",
      "author": "Lisa Cron",
      "kind": "book",
      "year": 2012,
      "contribution": "Open on a concrete problem and a goal in a worsening situation (cognitive framing, used as a lens not as evidence).",
      "playbooks": ["narrative"]
    },
    {
      "name": "The Hero with a Thousand Faces",
      "author": "Joseph Campbell",
      "kind": "book",
      "year": 1949,
      "contribution": "The departure-initiation-return arc for a transformation narrative (generic arc only; the staged template carries known bias).",
      "playbooks": ["narrative"]
    },
    {
      "name": "Poetics",
      "author": "Aristotle",
      "kind": "book",
      "year": null,
      "contribution": "Causal necessity over episodic listing; reversal and recognition; unity of action (public domain).",
      "playbooks": ["narrative"]
    },
    {
      "name": "Save the Cat!",
      "author": "Blake Snyder",
      "kind": "book",
      "year": 2005,
      "contribution": "Pacing and sequencing logic — setup, catalyst, escalation, low point, resolution (principle only, not the named beat sheet).",
      "playbooks": ["narrative", "talk-pitch"]
    },
    {
      "name": "And, But, Therefore (ABT)",
      "author": "Randy Olson",
      "kind": "framework",
      "year": 2015,
      "contribution": "Compress any pitch to one sentence: context AND context, BUT tension, THEREFORE action.",
      "playbooks": ["talk-pitch", "argument-memo", "narrative"]
    },
    {
      "name": "The Story Spine",
      "author": "Kenn Adams",
      "kind": "framework",
      "year": 1991,
      "contribution": "A five-line setup-disruption-because-of-that-resolution skeleton for a narrative or change story.",
      "playbooks": ["narrative"]
    }
  ],
  "metadata": {
    "family": "heuristics",
    "function": "design",
    "catalog_summary": "Structure, draft, or add a persuasive arc to a new piece of writing — argument/memo, technical doc, talk/pitch, narrative, or general prose — routed by intent (structure/draft/persuade) × genre."
  }
}
